{
  "run_metadata":{"run_id":"run-umg-synthetic","started_at":"2026-07-16T10:00:00Z","completed_at":"2026-07-16T10:05:00Z","skill":"unreal-media-brand-prospector","phase":1},
  "campaign":{"business_unit":"unreal-media-group","campaign_name":"UMG Synthetic Sample","discovery_scope":"open","verticals":[],"buyer_types":["brand"],"opportunity_filter":{"include_any":["product_photography","product_video"],"exclude":["ugc_ad"]},"target_prospect_count":5,"deep_research_limit":2,"minimum_qualification_score":72,"required_signals":["current launch"],"preferred_signals":[],"excluded_categories":[],"include_companies":[],"exclude_companies":[],"reengagement_enabled":false,"cooldown_days":120,"maximum_evidence_age_days":180,"output_formats":["json","markdown","html"],"prospect_history_path":"../history/prospect-history.json"},
  "history_loaded":true,
  "search_assumptions":["Synthetic public sources stand in for original official pages."],
  "raw_candidates":[{"company_name":"Synthetic Motion Goods","domain":"motiongoods.example"}],
  "results":[{"company_name":"Synthetic Motion Goods","company_type":"brand","business_unit":"unreal-media-group","identity":{"canonical_company_name":"synthetic motion goods","canonical_domain":"motiongoods.example","aliases":[],"social_handles":{},"parent_company":null,"subbrand_of":null},"discovery_event":{"discovered_at":"2026-07-16T10:01:00Z","campaign_name":"UMG Synthetic Sample","source_urls":["https://motiongoods.example/launch"]},"signals":[{"type":"product_launch","summary":"Synthetic brand announced a new activewear collection <test>.","source_url":"https://motiongoods.example/launch","source_date":"2026-07-15","basis":"observed","official_source":true}],"opportunity_matches":[{"kind":"product_photography","basis":"inferred_low_confidence","evidence_urls":["https://motiongoods.example/launch"],"reason":"The current product launch supports review for product photography."}],"score_snapshot":{"total":86,"dimensions":{"creative_need":4,"visual_fit":5,"budget_likelihood":4,"marketing_activity":4,"timing":5,"reachability":3,"evidence_quality":5}},"duplicate_decision":{"status":"new_prospect","reason":"No history match.","matched_prospect_id":null,"reengagement":false},"rejection_decision":{"rejected":false,"reasons":[]},"reason_for_qualification":"Current launch and repeat visual asset need fit UMG.","important_uncertainty":"Budget is inferred, not confirmed.","recommended_next_action":"Human review for deeper research.","future_handoff":{"ready":true,"human_approval_required_before_generation":true}}],
  "summary":{"raw_candidate_count":1,"new_unique_prospects":1,"duplicates":0,"reengagement_prospects":0,"rejections":0,"qualified_shortlist":1},
  "limitations":["Synthetic fixture; not a live prospect."],"validation_errors":[],"future_creative_handoff_readiness":"Metadata only; human approval and deeper source review are required before any creative work."
}
