{
  "run_metadata":{"run_id":"run-talent-synthetic","started_at":"2026-07-16T11:00:00Z","completed_at":"2026-07-16T11:06:00Z","skill":"unreal-talent-campaign-prospector","phase":1},
  "campaign":{"business_unit":"unreal-talent","campaign_name":"Talent Synthetic Sample","discovery_scope":"open","verticals":[],"buyer_types":["brand","agency"],"talent_categories":["athlete"],"rights_territory":["United States"],"target_prospect_count":5,"deep_research_limit":2,"minimum_qualification_score":78,"required_signals":["current campaign trigger"],"preferred_signals":[],"excluded_categories":[],"include_companies":[],"exclude_companies":[],"reengagement_enabled":false,"cooldown_days":180,"maximum_evidence_age_days":180,"output_formats":["json","markdown","html"],"prospect_history_path":"../history/prospect-history.json","approved_roster_path":null,"allow_named_talent_recommendations":false},
  "history_loaded":true,
  "search_assumptions":["No approved roster is loaded; archetype-only recommendations apply."],
  "raw_candidates":[{"company_name":"Synthetic Peak Beverage","domain":"peakbeverage.example"}],
  "results":[{"company_name":"Synthetic Peak Beverage","company_type":"brand","business_unit":"unreal-talent","identity":{"canonical_company_name":"synthetic peak beverage","canonical_domain":"peakbeverage.example","aliases":[],"social_handles":{},"parent_company":null,"subbrand_of":null},"discovery_event":{"discovered_at":"2026-07-16T11:01:00Z","campaign_name":"Talent Synthetic Sample","source_urls":["https://peakbeverage.example/partnership"]},"signals":[{"type":"partnership_announcement","summary":"Synthetic brand announced a national sports partnership.","source_url":"https://peakbeverage.example/partnership","source_date":"2026-07-14","basis":"observed","official_source":true}],"score_snapshot":{"total":87,"dimensions":{"campaign_talent_fit":5,"budget_likelihood":4,"current_trigger":5,"rights_readiness":4,"brand_roster_compatibility":3,"decision_path":4,"evidence_quality":5}},"duplicate_decision":{"status":"new_prospect","reason":"No history match.","matched_prospect_id":null,"reengagement":false},"rejection_decision":{"rejected":false,"reasons":[]},"reason_for_qualification":"A current national sports trigger supports an athlete-archetype campaign review.","important_uncertainty":"Budget, rights, conflicts, and roster fit require human validation.","recommended_next_action":"Internal rights and brand-safety review.","rights_territory":["United States"],"talent_recommendation_type":"archetype_only","talent_archetype":"Professional athlete with performance credibility","named_talent":null,"approved_roster_authorization":false,"rights_status":"requires_internal_rights_check","brand_safety_flags":[],"recommended_buyer_path":"brand_direct","future_handoff":{"ready":true,"human_approval_required_before_generation":true}}],
  "summary":{"raw_candidate_count":1,"new_unique_prospects":1,"duplicates":0,"reengagement_prospects":0,"rejections":0,"qualified_shortlist":1},
  "limitations":["Synthetic fixture; no roster or live rights data."],"validation_errors":[],"future_creative_handoff_readiness":"Archetype metadata only; roster, rights, conflict, brand-safety, and human approvals are required before any concept or likeness use."
}
